Java concurrency (multi-threading) - Tutorial, This article describes how to do concurrent programming     with     Java. It covers the concepts of parallel programming, immutability,     threads, the     executor framework (thread pools),     futures, callables CompletableFuture and     the     fork-join framework., http://www.vogella.com/tutorials/JavaConcurrency/article.html, lars.vogel@vogella.com (Lars Vogel), http://www.vogella.com/tutorials/JavaConcurrency/article.html
Eclipse Forms API - Tutorial, This article describes how to build user interfaces using     Eclipse Forms., http://www.vogella.com/tutorials/EclipseForms/article.html, lars.vogel@vogella.com (Lars Vogel), http://www.vogella.com/tutorials/EclipseForms/article.html
Extending the Eclipse IDE - Plug-in development - Tutorial, This article describes the creation and deployment of     Eclipse     plug-ins. The article is based on     Eclipse     4.4 (Luna)     and Java     1.6., http://www.vogella.com/tutorials/EclipsePlugIn/article.html, lars.vogel@vogella.com (Lars Vogel), http://www.vogella.com/tutorials/EclipsePlugIn/article.html
Eclipse Source Code - Tutorial, This     tutorial explains how to work with the     Eclipse source     code.     It assumes that you are already familiar with     using     the Eclipse IDE     and     is based on Eclipse 4.4 (Eclipse Luna)., http://www.vogella.com/tutorials/EclipseCodeAccess/article.html, lars.vogel@vogella.com (Lars Vogel), http://www.vogella.com/tutorials/EclipseCodeAccess/article.html
Adding menus, toolbar and popup menus to the Eclipse IDE - Tutorial, This tutorials describes how to add commands, menus and     toolbar entries to the Eclipse IDE.    This article is based on Eclipse Kepler (4.3)., http://www.vogella.com/tutorials/EclipseCommands/article.html, lars.vogel@vogella.com (Lars Vogel), http://www.vogella.com/tutorials/EclipseCommands/article.html
Apache Ant - Tutorial, This tutorial describes the usage of Ant as a build tool to     compile Java     code, pack this code into     an executable jar and how to     create     Javadoc. The usage of Ant is     demonstrated within Eclipse and     from the command line. This tutorial     is based on Apache Ant 1.8.x., http://www.vogella.com/tutorials/ApacheAnt/article.html, lars.vogel@vogella.com (Lars Vogel), http://www.vogella.com/tutorials/ApacheAnt/article.html
Java Regex - Tutorial, This tutorial introduces the usage of regular     expressions and     describes their implementation     in Java. It also provides several Java     regular expression     examples., http://www.vogella.com/tutorials/JavaRegularExpressions/article.html, lars.vogel@vogella.com (Lars Vogel), http://www.vogella.com/tutorials/JavaRegularExpressions/article.html
Google App Engine - Python Development (with Eclipse) -
			Tutorial, This article describes the creation of a web application with     Python on     the Google App Engine. The example created in this article will be a simple Todo     list.     The usage of the email API will get demonstrated. Also     conditions in     the Django web template and formating of dates will     get demonstrated.     The article demonstrates optionally the usage of Eclipse for     developing, running and debugging the Google App Engine application., http://www.vogella.com/tutorials/GoogleAppEngine/article.html, lars.vogel@vogella.com (Lars Vogel), http://www.vogella.com/tutorials/GoogleAppEngine/article.html
JSF (JavaServer Faces) - Tutorial, This article describes how to develop JavaServer Faces web     applications with Eclipse WTP JSF tooling. It demonstrates managed     beans,     validators, external     resource bundles and the JSF navigation     concept.     This tutorial was developed with Java 1.6, JavaServerFaces     1.2, the Apache MyFaces JSF implementation, Tomcat 6.0 and Eclipse     3.6., http://www.vogella.com/tutorials/JavaServerFaces/article.html, lars.vogel@vogella.com (Lars Vogel), http://www.vogella.com/tutorials/JavaServerFaces/article.html
GWT - Tutorial, This tutorial describes how to develop a Web application with     GWT and     the Google Plugin for Eclipse. This article assumes basic     Eclipse and Java     knowledge. The tutorial     was developed     using JDK 1.6,     GWT 2.3 and Eclipse 3.7., http://www.vogella.com/tutorials/GWT/article.html, lars.vogel@vogella.com (Lars Vogel), http://www.vogella.com/tutorials/GWT/article.html
OSGi Modularity - Tutorial, This tutorial gives an overview of OSGi and its modularity     layer.     For this tutorial Eclipse 4.5 (Luna) is used., http://www.vogella.com/tutorials/OSGi/article.html, lars.vogel@vogella.com (Lars Vogel), http://www.vogella.com/tutorials/OSGi/article.html
Eclipse Extension Points and Extensions - Tutorial, This tutorial describes the definition and usage of the     Eclipse     Extension Points. The article is written for and     Eclipse     4.2 but you can easily adjust it for Eclipse 3.x., http://www.vogella.com/tutorials/EclipseExtensionPoint/article.html, lars.vogel@vogella.com (Lars Vogel), http://www.vogella.com/tutorials/EclipseExtensionPoint/article.html
The Spring Jdbc Template for database access - Tutorial, This article describes the usage of the Spring JDBC Template     in a stand-alone application., http://www.vogella.com/tutorials/SpringJDBC/article.html, lars.vogel@vogella.com (Lars Vogel), http://www.vogella.com/tutorials/SpringJDBC/article.html
Eclipse RCP based on the 3.x API - Tutorial, This tutorial describes how to develop Eclipse RCP     applications with Eclipse 3.x API., http://www.vogella.com/tutorials/Eclipse3RCP/article.html, lars.vogel@vogella.com (Lars Vogel), http://www.vogella.com/tutorials/Eclipse3RCP/article.html
JFace Data Binding - Tutorial, This tutorial explains Eclipse JFace Data Binding which can be     used to synchronize data between different objects.     This tutorial is     based on Eclipse 4.4 and Java 1.7., http://www.vogella.com/tutorials/EclipseDataBinding/article.html, lars.vogel@vogella.com (Lars Vogel), http://www.vogella.com/tutorials/EclipseDataBinding/article.html
Dependency Injection with the Spring Framework - Tutorial, This article describes how to use dependency injection with     the Spring Framework.     It first describes dependency injection as a general     principle, gives then an overview of Spring and explains then the     configuration of Spring with annotations and with XML., http://www.vogella.com/tutorials/SpringDependencyInjection/article.html, lars.vogel@vogella.com (Lars Vogel), http://www.vogella.com/tutorials/SpringDependencyInjection/article.html
Reporting with Eclipse BIRT and Java Objects (POJO's)
			- Tutorial, This tutorial describes how to use Eclipse BIRT for reporting     on simple Java Objects (POJO's). The     tutorial explains also how to deploy the resulting BIRT     report     into a     webcontainer (Tomcat) and how to use it in an Eclipse     RCP     application. Eclipse 3.7 (Indigo) is used for this tutorial., http://www.vogella.com/tutorials/EclipseBIRT/article.html, lars.vogel@vogella.com (Lars Vogel), http://www.vogella.com/tutorials/EclipseBIRT/article.html
Grails Development - Tutorial, This article explains how to build a Grails application.     This     article is based on Java 1.6 and Grails 2.4.4., http://www.vogella.com/tutorials/Grails/article.html, lars.vogel@vogella.com (Lars Vogel), http://www.vogella.com/tutorials/Grails/article.html
Excel and Java - Read and Write Excel with Java - Tutorial, This article demonstrate how to create and how to read Excel     files with the Java Excel API., http://www.vogella.com/tutorials/JavaExcel/article.html, lars.vogel@vogella.com (Lars Vogel), http://www.vogella.com/tutorials/JavaExcel/article.html
JPA 2.0 with EclipseLink - Tutorial, This tutorial explains how to use EclipseLink, the reference     implementation for the Java Persistence API (JPA). The usage of     EclipseLink is demonstrated for stand-alone Java applications     (outside the     Java EE environment). The EclipseLink 2.3.X     implementation is used for this tutorial., http://www.vogella.com/tutorials/JavaPersistenceAPI/article.html, lars.vogel@vogella.com (Lars Vogel), http://www.vogella.com/tutorials/JavaPersistenceAPI/article.html
Ajax with the Dojo Toolkit - Tutorial, This article describes the usage of the Dojo toolkit for     JavaScript programming. Dojo is an Ajax toolkit., http://www.vogella.com/tutorials/AjaxwithDojo/article.html, lars.vogel@vogella.com (Lars Vogel), http://www.vogella.com/tutorials/AjaxwithDojo/article.html
Java and XML - Tutorial, This article gives an introduction into XML and its usage     with Java. The Java Streaming API for XML (Stax) and the Java XPath     library are explained and demonstrated., http://www.vogella.com/tutorials/JavaXML/article.html, lars.vogel@vogella.com (Lars Vogel), http://www.vogella.com/tutorials/JavaXML/article.html
RSS feeds with Java - Tutorial, This tutorial explains how to read and create RSS feeds with     Java. It uses the Stax XML API. Eclipse     is used as the Java IDE and Java7 is used., http://www.vogella.com/tutorials/RSSFeed/article.html, lars.vogel@vogella.com (Lars Vogel), http://www.vogella.com/tutorials/RSSFeed/article.html
Introduction to the Eclipse JFace Table API - Tutorial, This tutorial explains the usage of Eclipse JFace     TableViewer     including label and content provider. This tutorial is based on     Eclipse 4.3., http://www.vogella.com/tutorials/EclipseJFaceTable/article.html, lars.vogel@vogella.com (Lars Vogel), http://www.vogella.com/tutorials/EclipseJFaceTable/article.html
DocBook - Tutorial, This tutorial explains how to write DocBook files in Eclipse     and how to convert these files into various output formats, e.g., to     HTML and PDF. It also explains how to configure XInclude to divide     the information into different source files.         This tutorial uses Docbook 4.5, the Saxon XLST processor in     version 6.5.5, Eclipse 4.3 and the XLST stylesheets in version     1.77.1., http://www.vogella.com/tutorials/DocBook/article.html, lars.vogel@vogella.com (Lars Vogel), http://www.vogella.com/tutorials/DocBook/article.html
Microsoft and Java Integration with Eclipse - Tutorial, This article will demonstrate how Eclipse SWT can be used to     integrate / use Microsoft applications. Eclipse is using the SWT GUI     framework. SWT does allow to integrated Microsoft application via     OLE (Object Linking and Embedding).Microsoft Outlook, Microsoft     Excel and the File explorer are used as examples. The examples used     are based on Eclipse RCP as this makes it easy to demonstrate the     usage but work also with stand-alone Java application (which are     using SWT). This article assumes that you are already familiar with using     the Eclipse IDE and with developing simple Eclipse RCP applications., http://www.vogella.com/tutorials/EclipseMicrosoftIntegration/article.html, lars.vogel@vogella.com (Lars Vogel), http://www.vogella.com/tutorials/EclipseMicrosoftIntegration/article.html
Java Logging API - Tutorial, This article describes how to use the Logging API in     Java     programs. It includes an example for creating an HTML logger., http://www.vogella.com/tutorials/Logging/article.html, lars.vogel@vogella.com (Lars Vogel), http://www.vogella.com/tutorials/Logging/article.html
Java Preferences API - Tutorial, This tutorial gives a introduction into the Java     Preference API     to save key/value pairs for a Java application., http://www.vogella.com/tutorials/JavaPreferences/article.html, lars.vogel@vogella.com (Lars Vogel), http://www.vogella.com/tutorials/JavaPreferences/article.html
